{
  "schema": "menagerie-bank/v3",
  "id": "q-0122",
  "need": "Hazard row for the structural-footnote mechanism: the unit convention the whole chapter rests on is stated only in footnote 1 at the foot of the first page, not in the body.",
  "query": "footnote million metric tons of carbon dioxide equivalent weight each gas by its global warming potential GWP",
  "question_language": "en",
  "answer_language": "en",
  "lane": "en->en",
  "signal": "exact",
  "mode": "any",
  "facet": "core",
  "stratum": "core",
  "mechanism": [
    "structural-footnote"
  ],
  "generator": "hazard",
  "set_kind": "any-of",
  "primary": [
    {
      "work_id": "epa-2016-ghg-inventory-1990-2014",
      "recipe_id": "epa-2016-ghg-inventory-1990-2014",
      "attachment_id": "epa-2016-ghg-inventory-chapter-3-energy-pdf",
      "attachment_key": "TNFGB8UX",
      "section": "3. Energy, footnote 1",
      "alternates": [
        {
          "page_printed": "3-1",
          "char_offset": 1459,
          "quote": "1 Estimates are presented in units of million metric tons of carbon dioxide equivalent (MMT CO2 Eq.), which weight each gas by its global warming potential, or GWP, value."
        }
      ],
      "chain": {
        "title": "Inventory of U.S. Greenhouse Gas Emissions and Sinks: 1990-2014",
        "author": "U.S. Environmental Protection Agency",
        "date": "2016",
        "identifier": "10.5281/zenodo.259515",
        "section_heading": "3. Energy",
        "page_printed": "3-1",
        "part_title": null,
        "part_byline": null
      }
    }
  ],
  "expected_miss": false,
  "expected_miss_mechanism": null,
  "reachability": {
    "computed_by": "bench/golden_gate.py validate --stamp",
    "export_sha256": "579ab8dd24d609077727764d7468a34c051b7676734da2a2a02a6233c2296ccc",
    "extraction": {
      "reindex_mode": "stock",
      "reindex_limits": "applied",
      "caps": {
        "fulltext.pdfMaxPages": 100,
        "fulltext.textMaxLength": 500000
      },
      "index_fulltext_max_chars": 40000,
      "recipe_sha256": "e3f18dc790c6292a8ff3013fc2c95b3e8992bd0bfeba6578e220371ff3072ca1"
    },
    "reachable": true,
    "rows": [
      {
        "attachment_key": "TNFGB8UX",
        "alternates": [
          {
            "reachable": true,
            "char_offset": 1459,
            "occurrences": 1,
            "reason": null,
            "within_index_cap": true
          }
        ]
      }
    ]
  },
  "provenance": {
    "author": "claude (0722 authoring lane Q1c)",
    "date": "2026-09-06",
    "page_read": true
  }
}
