{
  "schema": "menagerie-bank/v3",
  "id": "q-0358",
  "need": "在打開文獻之前寫下：《大越史記全書》的凡例怎樣處理北朝（中國）歷代君主的稱謂——書「帝」還是書「主」？所持的理由是什麼？",
  "query": "大越史記全書 凡例 北朝歷代主皆書帝 與我各帝一方",
  "question_language": "zh",
  "answer_language": "zh",
  "lane": "zh->zh",
  "signal": "exact",
  "mode": "any",
  "facet": "core",
  "stratum": "core",
  "mechanism": [
    "han-script-no-word-spaces"
  ],
  "generator": "need",
  "set_kind": "any-of",
  "primary": [
    {
      "work_id": "dai-viet-su-ky-toan-thu-quyen-thu-zh",
      "recipe_id": "dai-viet-su-ky-toan-thu-quyen-thu-zh",
      "attachment_id": "dai-viet-su-ky-toan-thu-quyen-thu-zh-html",
      "attachment_key": "EHT9EUU2",
      "section": "篡修大越史記全書凣例",
      "alternates": [
        {
          "page_printed": null,
          "quote": "一、北朝歷代主皆書帝，與我各帝一方也。",
          "char_offset": 4279
        }
      ],
      "chain": {
        "title": "大越史記全書 卷首 (Đại Việt sử ký toàn thư, quyển thủ)",
        "author": "吳士連 Ngô Sĩ Liên et al.",
        "date": "1697",
        "identifier": "https://zh.wikisource.org/w/index.php?title=%E5%A4%A7%E8%B6%8A%E5%8F%B2%E8%A8%98%E5%85%A8%E6%9B%B8%2F%E5%8D%B7%E9%A6%96&oldid=5438794",
        "section_heading": "篡修大越史記全書凣例",
        "page_printed": null,
        "part_title": "凡例",
        "part_byline": null
      }
    }
  ],
  "expected_miss": false,
  "expected_miss_mechanism": null,
  "reachability": {
    "computed_by": "bench/golden_gate.py validate --stamp",
    "export_sha256": "579ab8dd24d609077727764d7468a34c051b7676734da2a2a02a6233c2296ccc",
    "extraction": {
      "reindex_mode": "stock",
      "reindex_limits": "applied",
      "caps": {
        "fulltext.pdfMaxPages": 100,
        "fulltext.textMaxLength": 500000
      },
      "index_fulltext_max_chars": 40000,
      "recipe_sha256": "e3f18dc790c6292a8ff3013fc2c95b3e8992bd0bfeba6578e220371ff3072ca1"
    },
    "reachable": true,
    "rows": [
      {
        "attachment_key": "EHT9EUU2",
        "alternates": [
          {
            "reachable": true,
            "char_offset": 4279,
            "occurrences": 1,
            "reason": null,
            "within_index_cap": true
          }
        ]
      }
    ]
  },
  "provenance": {
    "author": "claude (0722 authoring lane Q3b)",
    "date": "2026-09-06",
    "page_read": false
  }
}
