{
  "schema": "menagerie-bank/v3",
  "id": "q-0369",
  "need": "Hazard: a Vietnamese lexical false positive. 'Mày râu' reads literally as eyebrows and beard, and a body-part query retrieves it as such; in the verse it is the whole of a man's grooming and, by extension, the man himself, and the couplet is a portrait of the buyer Mã Giám Sinh, not a description of facial hair. 'Trạc ngoại tứ tuần' compounds it: 'tuần' is a ten-day period elsewhere in the language and a decade of age here, so a reader who resolves the words one by one gets forty days rather than forty years.",
  "query": "câu thơ nào trong Truyện Kiều tả một người đàn ông ngoài bốn mươi tuổi, mặt nhẵn không râu, ăn mặc chải chuốt",
  "question_language": "vi",
  "answer_language": "vi",
  "lane": "vi->vi",
  "signal": "paraphrase",
  "mode": "any",
  "facet": "core",
  "stratum": "reserve",
  "mechanism": [
    "lexical-false-positive",
    "indirect-description"
  ],
  "generator": "hazard",
  "set_kind": "any-of",
  "primary": [
    {
      "work_id": "nguyen-du-truyen-kieu-vi-wikisource",
      "recipe_id": "nguyen-du-truyen-kieu-vi-wikisource",
      "attachment_id": "nguyen-du-truyen-kieu-vi-wikisource-html",
      "attachment_key": "8ZXPNMC6",
      "section": "Câu 625–628",
      "alternates": [
        {
          "page_printed": null,
          "quote": "Hỏi tên rằng: Mã Giám Sinh.\nHỏi quê, rằng: Huyện Lâm Thanh cũng gần.\nQuá niên trạc ngoại tứ tuần,\nMày râu nhẵn nhụi, áo quần bảnh bao.",
          "char_offset": 21350
        }
      ],
      "chain": {
        "title": "Truyện Kiều (Đoạn trường tân thanh)",
        "author": "Nguyễn Du",
        "date": "1820",
        "identifier": "https://vi.wikisource.org/w/index.php?title=Truy%E1%BB%87n_Ki%E1%BB%81u&oldid=205132",
        "section_heading": null,
        "page_printed": null,
        "part_title": "Câu 625–628",
        "part_byline": null
      }
    }
  ],
  "expected_miss": false,
  "expected_miss_mechanism": null,
  "reachability": {
    "computed_by": "bench/golden_gate.py validate --stamp",
    "export_sha256": "579ab8dd24d609077727764d7468a34c051b7676734da2a2a02a6233c2296ccc",
    "extraction": {
      "reindex_mode": "stock",
      "reindex_limits": "applied",
      "caps": {
        "fulltext.pdfMaxPages": 100,
        "fulltext.textMaxLength": 500000
      },
      "index_fulltext_max_chars": 40000,
      "recipe_sha256": "e3f18dc790c6292a8ff3013fc2c95b3e8992bd0bfeba6578e220371ff3072ca1"
    },
    "reachable": true,
    "rows": [
      {
        "attachment_key": "8ZXPNMC6",
        "alternates": [
          {
            "reachable": true,
            "char_offset": 21350,
            "occurrences": 1,
            "reason": null,
            "within_index_cap": true
          }
        ]
      }
    ]
  },
  "provenance": {
    "author": "claude (0722 authoring lane Q3b)",
    "date": "2026-09-06",
    "page_read": false
  }
}
