{
  "schema": "menagerie-bank/v3",
  "id": "q-0300",
  "need": "Viết trước khi mở tài liệu: trong bài Tựa, Trần Trọng Kim nói nước ta bắt đầu có sử từ đời nào, thế kỷ nào?",
  "query": "Trần Trọng Kim nước Việt ta khởi đầu có sử từ đời nhà Trần thế kỷ XIII",
  "question_language": "vi",
  "answer_language": "vi",
  "lane": "vi->vi",
  "signal": "exact",
  "mode": "any",
  "facet": "core",
  "stratum": "core",
  "mechanism": [],
  "generator": "need",
  "set_kind": "any-of",
  "primary": [
    {
      "work_id": "tran-trong-kim-1920-viet-nam-su-luoc-wikisource",
      "recipe_id": "tran-trong-kim-1920-viet-nam-su-luoc-wikisource",
      "attachment_id": "tran-trong-kim-1920-viet-nam-su-luoc-wikisource-html",
      "attachment_key": "P223HCRG",
      "section": "Tựa",
      "alternates": [
        {
          "page_printed": null,
          "char_offset": 881,
          "quote": "Nước Việt ta khởi đầu có sử từ đời nhà Trần, vào quãng thế-kỷ thứ XIII."
        }
      ],
      "chain": {
        "title": "Việt Nam sử lược (Tựa)",
        "author": "Trần Trọng Kim",
        "date": "1920",
        "identifier": "https://vi.wikisource.org/w/index.php?title=Vi%E1%BB%87t_Nam_s%E1%BB%AD_l%C6%B0%E1%BB%A3c%2FQuy%E1%BB%83n_I%2FT%E1%BB%B1a&oldid=100853",
        "section_heading": "TỰA",
        "page_printed": null,
        "part_title": "Tựa",
        "part_byline": "Trần Trọng Kim"
      }
    }
  ],
  "expected_miss": false,
  "expected_miss_mechanism": null,
  "reachability": {
    "computed_by": "bench/golden_gate.py validate --stamp",
    "export_sha256": "579ab8dd24d609077727764d7468a34c051b7676734da2a2a02a6233c2296ccc",
    "extraction": {
      "reindex_mode": "stock",
      "reindex_limits": "applied",
      "caps": {
        "fulltext.pdfMaxPages": 100,
        "fulltext.textMaxLength": 500000
      },
      "index_fulltext_max_chars": 40000,
      "recipe_sha256": "e3f18dc790c6292a8ff3013fc2c95b3e8992bd0bfeba6578e220371ff3072ca1"
    },
    "reachable": true,
    "rows": [
      {
        "attachment_key": "P223HCRG",
        "alternates": [
          {
            "reachable": true,
            "char_offset": 881,
            "occurrences": 1,
            "reason": null,
            "within_index_cap": true
          }
        ]
      }
    ]
  },
  "provenance": {
    "author": "claude (0722 authoring lane Q3)",
    "date": "2026-09-06",
    "page_read": true
  }
}
