{
  "schema": "menagerie-bank/v3",
  "id": "q-0404",
  "need": "Written before opening the document: how did Keynes redefine inflation away from the purely monetary nineteenth-century account — what quantity does he say exceeds what? Asked in English against an Arabic encyclopaedia article.",
  "query": "Keynes redefinition of inflation as aggregate demand persistently exceeding real productive capacity",
  "question_language": "en",
  "answer_language": "ar",
  "lane": "en->ar",
  "signal": "paraphrase",
  "mode": "any",
  "facet": "core",
  "stratum": "core",
  "mechanism": [
    "should-language-arabic",
    "cross-lingual-en-to-ar",
    "rtl-script"
  ],
  "generator": "need",
  "set_kind": "any-of",
  "primary": [
    {
      "work_id": "wp-inflation-ar",
      "recipe_id": "wp-inflation-ar",
      "attachment_id": "wp-inflation-ar-html",
      "attachment_key": "4H4FFJA2",
      "section": "تاريخ التضخم",
      "alternates": [
        {
          "page_printed": null,
          "char_offset": 6667,
          "quote": "وهكذا توصل «كينز» إلى أن التضخم هو: زيادة حجم الطلب الكلي على حجم العرض الحقيقي زيادة محسوسة ومستمرة"
        }
      ],
      "chain": {
        "title": "تضخم اقتصادي",
        "author": "Wikipedia contributors",
        "date": "2026",
        "identifier": "https://ar.wikipedia.org/w/index.php?title=تضخم_اقتصادي&oldid=76021974",
        "section_heading": "تاريخ التضخم",
        "page_printed": null,
        "part_title": null,
        "part_byline": null
      }
    }
  ],
  "expected_miss": false,
  "expected_miss_mechanism": null,
  "reachability": {
    "computed_by": "bench/golden_gate.py validate --stamp",
    "export_sha256": "579ab8dd24d609077727764d7468a34c051b7676734da2a2a02a6233c2296ccc",
    "extraction": {
      "reindex_mode": "stock",
      "reindex_limits": "applied",
      "caps": {
        "fulltext.pdfMaxPages": 100,
        "fulltext.textMaxLength": 500000
      },
      "index_fulltext_max_chars": 40000,
      "recipe_sha256": "e3f18dc790c6292a8ff3013fc2c95b3e8992bd0bfeba6578e220371ff3072ca1"
    },
    "reachable": true,
    "rows": [
      {
        "attachment_key": "4H4FFJA2",
        "alternates": [
          {
            "reachable": true,
            "char_offset": 6667,
            "occurrences": 1,
            "reason": null,
            "within_index_cap": true
          }
        ]
      }
    ]
  },
  "provenance": {
    "author": "claude (0722 authoring lane Q4)",
    "date": "2026-09-06",
    "page_read": false
  }
}
