{
  "schema": "menagerie-bank/v3",
  "id": "q-0172",
  "need": "Written before opening the document: the framework's energy-price scenario table — what electricity price in CHF/kWh does it assume for 2016 and for 2050?",
  "query": "Table 1 energy prices 2016 and basic energy price scenario until 2050 electricity CH-Mix CHF/kWh",
  "question_language": "en",
  "answer_language": "en",
  "lane": "en->en",
  "signal": "exact",
  "mode": "any",
  "facet": "core",
  "stratum": "core",
  "mechanism": [
    "structural-table",
    "wrong-item-type"
  ],
  "generator": "hazard",
  "set_kind": "any-of",
  "primary": [
    {
      "work_id": "wittkopf-2016-bipv-methodological-framework",
      "recipe_id": "wittkopf-2016-bipv-methodological-framework",
      "attachment_id": "wittkopf-2016-bipv-methodological-framework-pdf",
      "attachment_key": "LRIU5TC8",
      "section": "3.1.1 Energy prices, Table 1",
      "alternates": [
        {
          "page_printed": "8",
          "char_offset": 16185,
          "quote": "Electricity (CH-Mix) CHF/kWh 0.20 0.20 0.22 0.23 0.24 Table 1: Energy prices 2016 and basic energy price scenario until 2050"
        }
      ],
      "chain": {
        "title": "Common methodological framework to assess energy, climate and economic impacts of BIPV",
        "author": "Walter Ott; Meta Lehmann; Stephen Wittkopf (ed.)",
        "date": "2016",
        "identifier": "10.5281/zenodo.1405881",
        "part_title": null,
        "part_byline": null,
        "section_heading": "3.1.1 Energy prices",
        "page_printed": "8"
      }
    }
  ],
  "expected_miss": false,
  "expected_miss_mechanism": null,
  "reachability": {
    "computed_by": "bench/golden_gate.py validate --stamp",
    "export_sha256": "579ab8dd24d609077727764d7468a34c051b7676734da2a2a02a6233c2296ccc",
    "extraction": {
      "reindex_mode": "stock",
      "reindex_limits": "applied",
      "caps": {
        "fulltext.pdfMaxPages": 100,
        "fulltext.textMaxLength": 500000
      },
      "index_fulltext_max_chars": 40000,
      "recipe_sha256": "e3f18dc790c6292a8ff3013fc2c95b3e8992bd0bfeba6578e220371ff3072ca1"
    },
    "reachable": true,
    "rows": [
      {
        "attachment_key": "LRIU5TC8",
        "alternates": [
          {
            "reachable": true,
            "char_offset": 16185,
            "occurrences": 1,
            "reason": null,
            "within_index_cap": true
          }
        ]
      }
    ]
  },
  "provenance": {
    "page_read": true,
    "author": "claude (0722 authoring lane Q1b)",
    "date": "2026-09-06"
  }
}
